content_type,content,created_at,content_id,machine_id,chat_group_id,sources
prompt,How does the Tesla Model Y stack up against the Audi e-tron in terms of battery range and charging capabilities for long road trips in 2025?,2025-06-28T04:18:45,790f1547-c89f-4169-a1fe-7990df215639,dafd024a-24e8-4097-b6fb-0a2a64c0798e,d50e3707-3437-487d-bc81-f2573e6464f8,
response,"In 2025, the Tesla Model Y may still have an edge over the Audi e-tron in terms of battery range and charging capabilities for long road trips. Tesla has a more extensive supercharging network, which allows for faster and more convenient charging on long journeys compared to Audi's charging infrastructure. 

The Tesla Model Y also typically offers longer range options compared to the Audi e-tron, allowing for fewer stops and faster travel times between charging stations. However, the Audi e-tron may have made improvements to its battery technology and charging capabilities by 2025, narrowing the gap between the two vehicles.

Ultimately, it is important to consider the specific configuration and options available for each vehicle in 2025 to accurately compare their battery range and charging capabilities for long road trips.",2025-06-28T04:20:34,9dab9bd2-db17-488d-9695-dc999b563961,dafd024a-24e8-4097-b6fb-0a2a64c0798e,d50e3707-3437-487d-bc81-f2573e6464f8,https://carbuzz.net/battery-comparison
prompt,How does the Tesla Model S Plaid compare to the Mercedes-Benz EQS in terms of acceleration and range in 2025?,2025-06-04T17:42:58,b0bb9421-f15b-4935-aef8-d71315eba34f,2d553813-28a2-41b1-9995-d11e98d141d8,1b673fa3-2fdd-4807-aac3-b70ff1c4f193,
response,"In 2025, the Tesla Model S Plaid is expected to outperform the Mercedes-Benz EQS in terms of acceleration and range. The Model S Plaid is known for its incredible acceleration capabilities, with a 0-60 mph time of under 2 seconds. On the other hand, the Mercedes-Benz EQS is known for its luxurious interior and advanced technology features, but may not be as fast off the line as the Model S Plaid.

In terms of range, the Tesla Model S Plaid is also expected to have a longer range than the Mercedes-Benz EQS. The Model S Plaid currently has a range of over 390 miles on a single charge, and it is likely that this range will increase even further by 2025. The Mercedes-Benz EQS, while offering a respectable range, may not be able to match the capabilities of the Tesla Model S Plaid in this regard.

Overall, if acceleration and range are important factors for you, the Tesla Model S Plaid would likely be the better choice compared to the Mercedes-Benz EQS in 2025.",2025-06-04T17:44:47,ad9c869d-e57e-402c-a7b1-c2842db7f525,2d553813-28a2-41b1-9995-d11e98d141d8,1b673fa3-2fdd-4807-aac3-b70ff1c4f193,
prompt,"Is the Tesla Model Y still the top choice for electric SUV enthusiasts in 2025, or has the Rivian R1T's unique off-road capabilities stolen the spotlight?",2025-06-09T10:51:32,8c863671-56df-435a-a0af-41c4f59a6bb1,7e0c133b-dcf7-4e44-b2e6-685c36663df4,2fd83d06-a80b-4fea-ad46-864323066f07,
response,"It is difficult to definitively say which vehicle is the top choice for electric SUV enthusiasts in 2025 as preferences and opinions can vary among individuals. However, both the Tesla Model Y and the Rivian R1T have their own unique strengths and appeal to different types of consumers.

The Tesla Model Y is known for its sleek design, advanced technology, and impressive performance, making it a popular choice among those looking for a high-tech and modern electric SUV. On the other hand, the Rivian R1T is renowned for its rugged off-road capabilities, making it a great option for outdoor enthusiasts and adventure seekers.

Ultimately, the choice between the Tesla Model Y and the Rivian R1T will depend on an individual's specific needs and preferences. Both vehicles are excellent options in the electric SUV market, and consumers will need to consider factors such as design, performance, range, and off-road capabilities when making their decision.",2025-06-09T10:53:25,3ad1efbf-caf4-4c68-8a31-2d60fb6fe96c,7e0c133b-dcf7-4e44-b2e6-685c36663df4,2fd83d06-a80b-4fea-ad46-864323066f07,https://reviewauto2025.com/hybrids
prompt,"How does the 2025 Tesla Model S Plaid compare to the upcoming Rivian R1T in terms of range, towing capacity, and overall performance capabilities?",2025-06-29T16:58:51,c733472b-bd6f-4886-b165-15246e42a27c,c6ea62fe-f1b1-47f7-838b-33186b4d93ba,b797b9e5-cd76-4374-91af-d3700343602a,
response,"As of now, it is difficult to provide a direct comparison between the 2025 Tesla Model S Plaid and the upcoming Rivian R1T as the exact specifications of the 2025 Model S Plaid have not been released. However, based on the current specifications of the Tesla Model S Plaid and the information available about the Rivian R1T, we can make some general comparisons.

In terms of range, the current Tesla Model S Plaid boasts an impressive range of over 390 miles on a single charge. The Rivian R1T, on the other hand, is expected to have a range of around 300 miles with the largest battery pack option. It is worth noting that these figures may change by the time the 2025 Model S Plaid is released.

When it comes to towing capacity, the Rivian R1T is expected to have a towing capacity of up to 11,000 pounds, making it a strong contender in this category. The Tesla Model S Plaid, on the other hand, has not been specifically rated for towing capacity but is not typically marketed as a vehicle designed for heavy towing.

In terms of overall performance capabilities, the Tesla Model S Plaid is known for its blistering acceleration and top speed, with a 0-60 mph time of under 2 seconds and a top speed of over 200 mph. The Rivian R1T, with its electric motors and off-road capabilities, is expected to offer impressive performance both on and off the road.

Ultimately, both the 2025 Tesla Model S Plaid and the Rivian R1T are likely to be top contenders in the electric vehicle market, each offering a unique set of features and capabilities. It will be interesting to see how they stack up against each other once the specific details of the 2025 Model S Plaid are released.",2025-06-29T16:59:54,780df963-3fc4-4590-bded-1d72efac319c,c6ea62fe-f1b1-47f7-838b-33186b4d93ba,b797b9e5-cd76-4374-91af-d3700343602a,https://autotrends.org/2025-electric-guide
prompt,How does the range and charging speed of the Tesla Model Y compare to the Audi e-tron in 2025?,2025-06-07T12:52:23,99bcc1f2-b4a2-47ba-b228-40bcbdd73128,fda15f52-7088-41e4-92c7-017dfbc94b04,aa07a6fc-d877-4302-b3ee-4182d6174753,
response,"In 2025, the range and charging speed of the Tesla Model Y are likely to be significantly better than those of the Audi e-tron. The Tesla Model Y is expected to have a range of over 300 miles on a single charge, while the Audi e-tron is likely to have a range of around 250 miles. Additionally, the Tesla Model Y is expected to have faster charging speeds, with the ability to charge up to 80% in as little as 15-20 minutes compared to the Audi e-tron's longer charging times. Overall, the Tesla Model Y is likely to offer better range and charging speed compared to the Audi e-tron in 2025.",2025-06-07T12:52:58,0cb29e9c-b659-4ff9-a7ae-56a665ee3059,fda15f52-7088-41e4-92c7-017dfbc94b04,aa07a6fc-d877-4302-b3ee-4182d6174753,https://autotrends.org/2025-electric-guide;https://cars.ai/news/top-picks
prompt,How does the acceleration of the Tesla Model 3 Performance compare to the Porsche Taycan Turbo in 2025?,2025-06-30T20:42:22,5c590e80-7fd4-4635-a004-22fc126c309f,7a0728e2-01de-4f70-b09d-157d4bcb5276,2619e45a-5829-4d4a-bb6a-f93b40728d7d,
response,"As of 2025, the acceleration of the Tesla Model 3 Performance and the Porsche Taycan Turbo may have evolved due to advancements in technology and improvements made by both manufacturers. 

In general, the Tesla Model 3 Performance is known for its impressive acceleration, capable of going from 0 to 60 mph in around 3.3 seconds. On the other hand, the Porsche Taycan Turbo is also known for its quick acceleration, with a 0-60 mph time of around 3 seconds. 

It is possible that both models have improved their acceleration capabilities by 2025, with potentially even faster acceleration times compared to their previous models. However, without specific data on these models in 2025, it is difficult to provide an accurate comparison of their acceleration performance. It is recommended to refer to the latest reviews and test drives of these models for the most up-to-date information on their acceleration capabilities.",2025-06-30T20:43:20,d8d86c42-142a-4135-aed8-15937f038d55,7a0728e2-01de-4f70-b09d-157d4bcb5276,2619e45a-5829-4d4a-bb6a-f93b40728d7d,https://cars.ai/news/top-picks
prompt,How does the acceleration of the Tesla Model Y compare to the Audi e-tron GT in 2025?,2025-06-28T06:46:33,9153e879-eda0-4e6a-a269-0706f3a2dfbd,708f61af-6a04-4f3c-a62a-00f7f2c7c1b4,c44d3255-a3e4-4ae8-bafb-04816ec7f07d,
response,"In 2025, both the Tesla Model Y and Audi e-tron GT are expected to have impressive acceleration capabilities, thanks to advancements in electric vehicle technology. The Tesla Model Y is known for its quick acceleration, with the Performance model boasting a 0-60 mph time of just 3.5 seconds.

On the other hand, the Audi e-tron GT is also a high-performance electric vehicle, with the RS model reaching 0-60 mph in just under 3.5 seconds as well. Both vehicles offer exhilarating acceleration and performance, making for an exciting driving experience.

Overall, the acceleration of the Tesla Model Y and Audi e-tron GT in 2025 is likely to be very similar, with both vehicles offering impressive speed and quick acceleration times. Ultimately, the choice between the two will come down to personal preference and other factors such as design, technology, and driving dynamics.",2025-06-28T06:47:46,34ef65e1-bb6e-4c10-a977-db7fbe70574c,708f61af-6a04-4f3c-a62a-00f7f2c7c1b4,c44d3255-a3e4-4ae8-bafb-04816ec7f07d,
prompt,How does the all-electric Rivian R1T compare to the Tesla Cybertruck in terms of towing capacity and off-road capabilities for adventurous families looking to upgrade their fleet in 2025?,2025-06-27T08:32:57,d934b947-8de0-4830-9f75-61c3a9dc15c8,99beeded-3aca-43a0-adcc-f302f937c3cd,7537a315-3789-42b5-a25e-03c6857ad9cd,
response,"Both the Rivian R1T and the Tesla Cybertruck are all-electric trucks that offer impressive towing capacities and off-road capabilities for adventurous families. 

The Rivian R1T has a towing capacity of up to 11,000 pounds, making it suitable for hauling trailers, boats, and other heavy equipment on outdoor excursions. It also features a quad-motor system that delivers excellent torque and off-road performance, allowing it to navigate rough terrain and challenging trails with ease. The R1T also offers a range of over 300 miles on a single charge, ensuring that families can explore remote locations without worrying about running out of power.

On the other hand, the Tesla Cybertruck boasts a towing capacity of up to 14,000 pounds, making it slightly more capable than the Rivian R1T in terms of pulling heavy loads. The Cybertruck's innovative exoskeleton design provides maximum durability and protection, making it ideal for off-road adventures where ruggedness is essential. Additionally, the Cybertruck offers impressive range and performance, with the top-tier model capable of traveling over 500 miles on a single charge.

Overall, both the Rivian R1T and the Tesla Cybertruck are excellent options for adventurous families looking to upgrade their fleet in 2025. The decision between the two will ultimately come down to personal preferences, such as towing capacity, range, design, and brand loyalty.",2025-06-27T08:33:36,e77be938-d95c-419b-a002-555792aec3ab,99beeded-3aca-43a0-adcc-f302f937c3cd,7537a315-3789-42b5-a25e-03c6857ad9cd,https://autotrends.org/2025-electric-guide
prompt,"Which electric SUV in 2025 offers the best combination of range, acceleration, and advanced tech features: the Tesla Model Y, Audi e-tron, or Jaguar I-PACE?",2025-06-13T23:51:20,f8f3acac-065e-447a-9595-00d3b2b7535c,5199585d-7301-47af-81a4-05e6c8bfb441,052738a0-5e1b-423a-9e56-69854a569257,
response,"As of now, it is difficult to predict which electric SUV in 2025 will offer the best combination of range, acceleration, and advanced tech features. However, based on current trends and advancements in electric vehicle technology, the Tesla Model Y is likely to remain a strong contender in 2025.

Tesla has a proven track record of pushing the boundaries of electric vehicle technology, offering industry-leading range, acceleration, and advanced tech features. With continued investment in research and development, it is possible that the Tesla Model Y could maintain its position as a top choice for electric SUVs in 2025.

That being said, Audi and Jaguar are also reputable luxury car manufacturers with strong electric SUV offerings in the form of the e-tron and I-PACE, respectively. Both companies have been investing heavily in electric vehicle technology and are likely to continue to improve their offerings in the coming years.

Ultimately, the best electric SUV in 2025 will depend on a variety of factors, including advances in technology, market trends, and consumer preferences. It is important to keep an eye on new developments in the electric vehicle industry to determine which SUV will offer the best combination of range, acceleration, and advanced tech features in 2025.",2025-06-13T23:52:19,63502251-8aac-4e55-a91f-5b8598a30f23,5199585d-7301-47af-81a4-05e6c8bfb441,052738a0-5e1b-423a-9e56-69854a569257,https://reviewauto2025.com/hybrids;https://carbuzz.net/battery-comparison
prompt,How does the rumored all-electric Ford Mustang Mach-E GT stack up against the upcoming Tesla Model Y in terms of acceleration and range for the 2025 model year?,2025-06-15T20:16:09,1299f26d-a0d2-4f49-a4e9-b87e83b7f018,3d7ad288-cf3d-4782-8f56-5693d019cd7d,44a8b549-35e0-4bd5-9634-0ab7ad02de77,
response,"As of now, since there is no official confirmation on the specifications of the 2025 model year for either the Ford Mustang Mach-E GT or the Tesla Model Y, it is difficult to directly compare the two vehicles in terms of acceleration and range for that specific model year. 

However, based on the current available information for the existing models, the Ford Mustang Mach-E GT has an estimated acceleration of 0-60 mph in around 3.3 seconds and a range of up to 260 miles, while the Tesla Model Y performance version has an acceleration of 0-60 mph in around 3.5 seconds and a range of up to 303 miles. 

It is likely that both Ford and Tesla will continue to improve and innovate their electric vehicles, so it is possible that the 2025 models of the Ford Mustang Mach-E GT and the Tesla Model Y could have even better acceleration and range. Thus, without specific information about the 2025 models, it is not possible to accurately compare them at this time.",2025-06-15T20:17:10,80378403-0750-479b-b42f-f30e64b70194,3d7ad288-cf3d-4782-8f56-5693d019cd7d,44a8b549-35e0-4bd5-9634-0ab7ad02de77,https://reviewauto2025.com/hybrids;https://autotrends.org/2025-electric-guide
prompt,How does the range and charging time of the Tesla Model Y compare to the Ford Mustang Mach-E in real-world driving conditions for a family road trip across the country in 2025?,2025-06-23T00:10:43,dd377b90-224b-4af5-9126-55cfb11d516f,aa3a0a43-5fca-4fc4-863d-17ca8bc420d7,8f77b219-7cad-447c-9a0a-535810640055,
response,"In 2025, the Tesla Model Y is expected to have an estimated range of around 390 miles on a single charge, while the Ford Mustang Mach-E is projected to have a range of about 300 miles. This means that the Tesla Model Y would have a longer driving range, potentially requiring fewer stops for charging during a cross-country road trip.

When it comes to charging time, the Tesla Model Y is equipped with the Supercharger network which allows for fast charging speeds, typically providing around 170 miles of range in just 15 minutes. On the other hand, the Ford Mustang Mach-E is expected to have similar fast-charging capabilities with DC fast chargers, but the charging network may not be as extensive as Tesla's Supercharger network.

Overall, the Tesla Model Y would likely offer a more convenient and efficient charging experience during a family road trip across the country in 2025, with its longer driving range and faster charging speeds compared to the Ford Mustang Mach-E.",2025-06-23T00:12:30,5e4ff7e0-464b-490d-bb5b-d3bd30147ca2,aa3a0a43-5fca-4fc4-863d-17ca8bc420d7,8f77b219-7cad-447c-9a0a-535810640055,https://autotrends.org/2025-electric-guide;https://reviewauto2025.com/hybrids
prompt,"What improvements can we expect to see in the upcoming 2025 model of the Tesla Model 3 compared to the popular 2022 version, especially in terms of range, acceleration, and self-driving features?",2025-06-12T16:20:18,a8207b9d-5ab6-452c-9ee9-dda6977ba7d8,a61e9f1e-a380-44cb-881c-622d0d7bc3f0,1392d37e-f735-4986-86bc-f5568c727397,
response,"The 2025 model of the Tesla Model 3 is expected to see improvements in range, acceleration, and self-driving features compared to the 2022 version. Some potential enhancements could include:

1. Range: The 2025 Model 3 may feature improved battery technology and efficiency, allowing for an increased range per charge compared to the 2022 version. This could result in a longer driving range on a single charge, providing drivers with more flexibility and convenience.

2. Acceleration: Tesla is known for its fast acceleration, and the 2025 Model 3 may offer even quicker acceleration compared to the 2022 version. This could be achieved through improvements in the electric motor and drivetrain technology, allowing for faster acceleration times and a more exhilarating driving experience.

3. Self-driving features: Tesla continues to advance its Autopilot and Full Self-Driving capabilities, and the 2025 Model 3 may come equipped with more advanced autonomous driving features than the 2022 version. This could include improved navigation, parking assistance, and safety features, bringing the Model 3 closer to full autonomy.

Overall, the 2025 Tesla Model 3 is likely to offer a more refined driving experience with enhanced performance, range, and self-driving capabilities compared to the 2022 version. Keep an eye out for official announcements from Tesla as they continue to innovate and improve their electric vehicles.",2025-06-12T16:20:51,1a0ce312-2182-465e-9d42-dd38ebf8410e,a61e9f1e-a380-44cb-881c-622d0d7bc3f0,1392d37e-f735-4986-86bc-f5568c727397,
prompt,"How does the acceleration of the Tesla Model Y compare to the Audi e-tron in 2025, considering both electric SUVs have become popular choices?",2025-06-05T06:20:54,e2daea9a-a133-4f53-ae49-0266227a76e2,33fa4dba-439b-422b-b60c-c74df2cc88d0,f550c773-ce9e-484c-9adb-bcc11bb25749,
response,"As of 2025, both the Tesla Model Y and the Audi e-tron are popular choices in the electric SUV market. In terms of acceleration, the Tesla Model Y is known for its impressive acceleration capabilities, with the Performance model being able to go from 0 to 60 mph in just 3.5 seconds. On the other hand, the Audi e-tron has a slightly slower acceleration, with the standard model going from 0 to 60 mph in around 5.5 seconds.

Overall, the Tesla Model Y has a faster acceleration compared to the Audi e-tron, making it a more dynamic and sporty choice for drivers who prioritize performance. The Model Y's acceleration capabilities are one of the key factors that have contributed to its popularity among electric SUV buyers.",2025-06-05T06:22:29,3999ddec-c498-4112-a58e-f4040b096e9d,33fa4dba-439b-422b-b60c-c74df2cc88d0,f550c773-ce9e-484c-9adb-bcc11bb25749,https://reviewauto2025.com/hybrids
prompt,How does the fuel efficiency of the all-electric Tesla Model 3 compare to the hybrid Toyota Prius Prime in city driving conditions for the year 2025?,2025-06-27T10:05:28,f27acc99-1dbf-4471-b986-dce471a2af06,d627f91c-082d-446d-ad8a-f85e2a2446b3,a9cfb836-f91e-4d71-91a2-288f1270f306,
response,"In general, all-electric vehicles like the Tesla Model 3 have higher fuel efficiency than hybrid vehicles like the Toyota Prius Prime because they do not rely on gasoline at all. The Tesla Model 3 is rated at around 141 MPGe (miles per gallon equivalent) in city driving conditions, while the Toyota Prius Prime is rated at around 55 MPG in city driving conditions.

Therefore, in 2025, it is expected that the Tesla Model 3 will have significantly higher fuel efficiency in city driving conditions compared to the Toyota Prius Prime. This means that the Tesla Model 3 will be able to travel farther on a single charge than the Toyota Prius Prime can on a tank of gasoline in city driving conditions.",2025-06-27T10:06:04,5e52a97d-181a-454e-9221-8a5db82e11c7,d627f91c-082d-446d-ad8a-f85e2a2446b3,a9cfb836-f91e-4d71-91a2-288f1270f306,
prompt,"I'm considering purchasing an electric vehicle in 2025 and I can't decide between the Tesla Model 3 and the Volkswagen ID.4. Can anyone provide insights on the range, charging infrastructure, and overall performance of these two vehicles to help me make a decision?",2025-06-28T12:28:24,7517b319-6bcc-4d5e-80d7-52afa7406872,df78ebc2-4d94-4a57-83b0-884e0118d19a,e75cf082-b915-4439-bdcd-3bb651236701,
response,"In 2025, both the Tesla Model 3 and the Volkswagen ID.4 are likely to have undergone advancements in range, charging infrastructure, and overall performance. However, as of now, here are some key points to consider:

Tesla Model 3:
- Range: The Tesla Model 3 currently has a range of up to 353 miles on a single charge, making it one of the longest-range electric vehicles available.
- Charging Infrastructure: Tesla has an extensive network of Supercharger stations across the world, making long-distance travel more convenient.
- Performance: The Tesla Model 3 is known for its impressive acceleration, handling, and overall driving experience.

Volkswagen ID.4:
- Range: The Volkswagen ID.4 currently has a range of up to 260 miles on a single charge, which is still quite competitive but not as high as the Tesla Model 3.
- Charging Infrastructure: Volkswagen is investing in expanding its charging infrastructure through partnerships with companies like Electrify America, which is helping to build a more robust network of fast chargers.
- Performance: The Volkswagen ID.4 offers a smooth and comfortable ride, with good acceleration and handling.

Ultimately, the choice between the Tesla Model 3 and the Volkswagen ID.4 will depend on your specific needs and priorities. If range and charging infrastructure are key considerations for you, the Tesla Model 3 may be the better option. However, if you value a comfortable and practical SUV design, the Volkswagen ID.4 could be the right choice for you. It is recommended that you test drive both vehicles and consider factors such as price, features, and brand preferences before making a decision.",2025-06-28T12:29:54,12a4955e-b502-478e-8b3c-3bbc53cc5dbe,df78ebc2-4d94-4a57-83b0-884e0118d19a,e75cf082-b915-4439-bdcd-3bb651236701,https://reviewauto2025.com/hybrids
prompt,How does the electric range of the Tesla Model Y compare to the Audi e-tron's in real-world driving conditions by 2025?,2025-06-01T12:52:30,1d4ab5d2-0ada-4300-8e98-1042d7cc165c,4f7eb9dd-66ab-46ea-8627-fa1c857ed988,3f140661-df33-414c-b320-f666d1582ca8,
response,"It is difficult to predict the exact electric range of the Tesla Model Y and Audi e-tron  in real-world driving conditions by 2025 as it depends on various factors such as advancements in battery technology, driving habits, weather conditions, and road conditions. However, Tesla is known for its efficiency in electric vehicle range and constantly improving battery technology, so it is possible that the Model Y may have a longer range than the Audi e-tron by 2025. Audi e-tron also continues to work on improving its electric range, so it is also possible that it may see improvements in its range by 2025. Overall, the competition between Tesla and Audi in electric range will likely continue to evolve as both companies strive to improve their electric vehicles' performance.",2025-06-01T12:53:29,1348de82-47e3-41d3-bc26-c3d0a303a2c8,4f7eb9dd-66ab-46ea-8627-fa1c857ed988,3f140661-df33-414c-b320-f666d1582ca8,
prompt,"How does the upcoming 2025 Ford Mustang Mach-E compare to the Tesla Model Y in terms of range, acceleration, and overall driving experience?",2025-06-17T13:19:52,15e7bf7d-db85-42c5-8082-89aeabf79911,a22a66db-2f9c-4d82-a8f0-a0e0352fc095,26a1513d-42fb-428b-ad3d-80b3e3695285,
