content_type,content,created_at,content_id,machine_id,chat_group_id,sources
response,"As we move towards 2025, the all-electric Volvo XC40 Recharge and the Tesla Model Y will continue to be popular electric SUV options for consumers. Here's how they compare in terms of range, charging infrastructure availability, and overall driving experience:

Range: The Volvo XC40 Recharge has an estimated range of around 208 miles, while the Tesla Model Y has a range of up to 326 miles. Tesla has been known for having industry-leading range in their electric vehicles, so it's likely that the Model Y will continue to have a higher range than the XC40 Recharge as both companies continue to improve their battery technology.

Charging infrastructure availability: Tesla currently has an extensive network of Superchargers, making it easy for Tesla owners to find a fast charging station on road trips or during daily commutes. While Volvo is starting to roll out more fast-charging stations specifically for their electric vehicles, they may not have as comprehensive of a network as Tesla by 2025. However, the overall charging infrastructure for electric vehicles is expected to continue expanding, making it easier for both Volvo and Tesla owners to find convenient charging options.

Overall driving experience: Both the Volvo XC40 Recharge and the Tesla Model Y offer a smooth and quiet driving experience, typical of electric vehicles. The Model Y has been praised for its performance and handling, as well as its user-friendly infotainment system. Volvo is known for its safety features and luxurious interiors, so the XC40 Recharge may appeal to those who prioritize these aspects in their driving experience. As technology continues to advance, both Volvo and Tesla are likely to introduce new features and improvements to enhance the overall driving experience of their electric SUVs.

In summary, while the Tesla Model Y may have a longer range and more established charging infrastructure by 2025, the Volvo XC40 Recharge still offers a competitive electric SUV option with its unique features and driving experience. Consumers will have to consider their own priorities and preferences when choosing between these two electric vehicles in the coming years.",2025-06-01T11:17:12,b443061d-3b06-4041-b3f6-eb46ad8d74bb,bc482497-7de8-4136-b2fc-c12739434fda,6f0f0e3c-fdb4-4046-80f5-db42edb8c1e9,https://cars.ai/news/top-picks
prompt,How does the acceleration of the Tesla Model Y compare to that of the BMW iX in 2025?,2025-06-23T16:06:57,e15c8b2e-e660-40b5-acb7-09df8260a304,8c18f7e5-314a-460c-aa65-08f8a17afa10,1c40c4d1-9f7e-4ba2-b77e-12e68f465767,
response,"As of 2025, it is difficult to predict the exact acceleration figures of the Tesla Model Y and the BMW iX as they may vary depending on the specific configurations and models of each vehicle. However, historically, Tesla vehicles have been known for their impressive acceleration due to their electric powertrains, while BMW vehicles also offer strong performance capabilities.

In general, the Tesla Model Y has been praised for its quick acceleration, with the Performance variant in particular being able to go from 0 to 60 mph in around 3.5 seconds. On the other hand, the BMW iX is a luxury electric SUV that is also expected to offer strong acceleration, though specific figures may vary.

Ultimately, the best way to compare the acceleration of the two vehicles would be to look at the specific performance data for each model as they become available closer to their release dates in 2025. It is likely that both the Tesla Model Y and the BMW iX will offer impressive acceleration capabilities, but the exact figures will depend on a variety of factors including powertrain technology, battery capacity, and overall vehicle design.",2025-06-23T16:07:30,76d5030b-e1ad-4ba8-9cc4-11a2a9c7902b,8c18f7e5-314a-460c-aa65-08f8a17afa10,1c40c4d1-9f7e-4ba2-b77e-12e68f465767,https://autotrends.org/2025-electric-guide
prompt,"How does the 2025 Tesla Model S Plaid compare to the Audi e-tron GT in terms of acceleration, range, and luxury features?",2025-06-16T15:42:48,012f5e5c-cff8-442f-a9db-68917619c229,079cbe45-a9bd-465d-b506-ce1580fd2392,4743fb2c-dbf6-4911-993a-47137e36e470,
response,"In terms of acceleration, the 2025 Tesla Model S Plaid is likely to outperform the Audi e-tron GT. The Model S Plaid is known for its impressive acceleration, with a 0-60 mph time of under 2 seconds. The Audi e-tron GT, while still fast, may not be able to match the acceleration of the Model S Plaid.

When it comes to range, the Tesla Model S Plaid is also expected to have a longer range than the Audi e-tron GT. Tesla vehicles are known for their industry-leading range, and the Model S Plaid is likely to continue that trend with a range of over 400 miles on a single charge. The Audi e-tron GT, while offering a respectable range, may not be able to match the range of the Model S Plaid.

In terms of luxury features, both the Tesla Model S Plaid and the Audi e-tron GT are expected to offer a range of high-end features and amenities. Both vehicles are likely to come equipped with premium materials, advanced infotainment systems, and cutting-edge technology. However, Tesla vehicles are known for their minimalist interior design and futuristic features, while Audi vehicles are known for their luxurious and refined interiors. Ultimately, the choice between the two vehicles may come down to personal preference in terms of design and features.",2025-06-16T15:43:33,ab8596da-538c-44a1-9d6f-ca8350631e02,079cbe45-a9bd-465d-b506-ce1580fd2392,4743fb2c-dbf6-4911-993a-47137e36e470,
prompt,How does the acceleration of the Tesla Model S Plaid compare to the Rivian R1T when it comes to off-road performance in 2025?,2025-06-10T08:35:16,5b0b40df-00d0-4e38-917e-a4169fd97991,fee94fd8-c3d1-4175-b981-dcb1b6c50034,82d3142d-7a83-4977-b155-650fe67d0387,
response,"In 2025, the Tesla Model S Plaid has been designed primarily for on-road performance and speed, rather than off-road capabilities. On the other hand, the Rivian R1T is an electric truck specifically built for off-road performance, with features such as all-wheel drive, adjustable ride height, and advanced off-road driving modes.

As a result, the acceleration of the Tesla Model S Plaid would likely be superior to the Rivian R1T on basic paved roads. However, when it comes to off-road performance, the Rivian R1T would likely outperform the Tesla Model S Plaid due to its specialized design and features tailored for rugged terrain.

Overall, the Rivian R1T would be better suited for off-road driving in 2025 compared to the Tesla Model S Plaid.",2025-06-10T08:36:16,737028dc-b321-49e7-8618-f95922534bb9,fee94fd8-c3d1-4175-b981-dcb1b6c50034,82d3142d-7a83-4977-b155-650fe67d0387,
prompt,"Will the Tesla Model 3 still be considered the leader in range and efficiency among electric vehicles by 2025, or do you think competitors like the upcoming VW ID. Buzz could take the crown with their innovative battery technology?",2025-06-18T05:01:12,a8a63e79-fa99-49fd-a25f-70322b52257a,0d5ba9b9-7e85-4e92-b9ab-bd138e982b77,0d390718-948c-429b-ba6d-e6694d80caa1,
response,"It is difficult to predict the future of electric vehicle technology, but it is possible that competitors like the VW ID. Buzz could challenge the Tesla Model 3's position as the leader in range and efficiency by 2025. The rapid advancements in battery technology and electric vehicle development could result in new vehicles surpassing the Model 3 in terms of range and efficiency. However, Tesla has a strong track record of innovation and could also continue to push the boundaries of electric vehicle technology, so it is still possible that the Model 3 could remain a top contender in the electric vehicle market. Ultimately, only time will tell which vehicle will come out on top in terms of range and efficiency in the coming years.",2025-06-18T05:02:06,aafe9554-23e0-4382-bcc4-6f563eb17e82,0d5ba9b9-7e85-4e92-b9ab-bd138e982b77,0d390718-948c-429b-ba6d-e6694d80caa1,https://autotrends.org/2025-electric-guide;https://reviewauto2025.com/hybrids
prompt,"What kind of advancements can we expect to see in electric vehicles by 2025, specifically in regards to the range and charging capabilities of popular models like the Tesla Model Y, Audi e-tron, and Nissan Leaf?",2025-06-18T19:33:42,0afd0711-a1ff-442e-904b-ab8177e9853c,9aae0a6f-cfeb-413f-87fd-59000c720e9f,1336dfde-7925-4a88-b965-61f40ae61323,
response,"By 2025, we can expect to see significant advancements in the range and charging capabilities of electric vehicles like the Tesla Model Y, Audi e-tron, and Nissan Leaf. 

In terms of range, it is likely that these popular models will have significantly improved battery technology that will allow for longer driving distances on a single charge. This could mean ranges of over 400 miles for some models, making electric vehicles more practical for longer trips and reducing range anxiety for drivers.

Additionally, charging capabilities are also expected to improve by 2025. We could see faster charging times, with some models being able to charge to 80% capacity in as little as 15-20 minutes. This would make electric vehicles more convenient for drivers who need to recharge quickly on long road trips or during their daily commute.

Overall, by 2025, electric vehicles like the Tesla Model Y, Audi e-tron, and Nissan Leaf are likely to offer significant improvements in range and charging capabilities, making them more competitive with traditional gasoline-powered vehicles and further accelerating the transition to electric transportation.",2025-06-18T19:34:56,2c790c2a-f819-431d-a4c4-fa0d4cdbaa51,9aae0a6f-cfeb-413f-87fd-59000c720e9f,1336dfde-7925-4a88-b965-61f40ae61323,https://autotrends.org/2025-electric-guide;https://reviewauto2025.com/hybrids
prompt,"How does the electric range of the Tesla Model Y compare to the Audi Q4 e-tron in real-world driving conditions, taking into account factors such as driving style, temperature, and terrain in 2025?",2025-06-24T08:33:21,98490f49-271e-4dfb-b8ab-5d79f6e2e85c,f17f1592-67c5-4f60-9af8-738a0f71a4f9,c0d1b0a7-280c-4470-b1b0-c68ae2d81f29,
response,"In 2025, the electric range of the Tesla Model Y and the Audi Q4 e-tron may still vary depending on several factors such as driving style, temperature, and terrain.

In general, the Tesla Model Y is known for its efficiency and longer range compared to other electric vehicles, including the Audi Q4 e-tron. This is primarily due to Tesla's proprietary battery technology and overall design optimization.

However, in real-world driving conditions, factors such as driving style, temperature, and terrain can significantly impact the range of both vehicles. For example, aggressive driving, frequent stops, and high speeds can all decrease the range of an electric vehicle.

Temperature can also have a big impact, as colder temperatures can reduce battery efficiency and overall range. Similarly, driving in hilly or mountainous terrain can require more energy and reduce the overall range of an electric vehicle compared to driving on flat terrain.

Overall, while the Tesla Model Y may still have a longer electric range compared to the Audi Q4 e-tron in 2025, drivers should be mindful of these factors and adjust their driving habits accordingly to maximize range and efficiency.",2025-06-24T08:34:28,ffe62239-d30a-4b19-ab3a-f2ccd324385e,f17f1592-67c5-4f60-9af8-738a0f71a4f9,c0d1b0a7-280c-4470-b1b0-c68ae2d81f29,https://cars.ai/news/top-picks
prompt,How does the expected electric range of the Tesla Model S compare to the Audi e-tron GT in 2025?,2025-06-08T15:13:15,647e0847-636a-4cdf-9d74-fb0dfec0f7ec,bf0a5ef0-b104-4408-8a43-5c72bc25f008,716a5dbc-6744-413d-b4cd-abb40451ae02,
response,"As of 2025, the expected electric range of the Tesla Model S is around 400 miles, while the Audi e-tron GT is expected to have a range of around 320 miles. Therefore, the Tesla Model S has a higher expected electric range compared to the Audi e-tron GT in 2025.",2025-06-08T15:13:50,28ddd794-e0f3-4079-aab7-7ccf2eb9a1b2,bf0a5ef0-b104-4408-8a43-5c72bc25f008,716a5dbc-6744-413d-b4cd-abb40451ae02,https://cars.ai/news/top-picks
prompt,How does the all-electric Audi e-tron GT compare to the Tesla Model S in terms of range and charging capabilities for long-distance road trips in 2025?,2025-06-04T01:42:05,e8b50536-14b7-4d49-86e6-7a4cf8d41db6,458afd0e-29a9-4262-b6d4-5e96127db0d4,cfc9e716-2760-4d83-9539-b0851476a243,
response,"As of 2025, the all-electric Audi e-tron GT and the Tesla Model S will likely have advanced in terms of range and charging capabilities. 

The Audi e-tron GT is expected to have a range of around 300-350 miles per charge, while the Tesla Model S could have a range of over 400 miles per charge. 

In terms of charging capabilities, both vehicles are likely to support fast charging which can significantly reduce charging times. The Audi e-tron GT could have a charging rate of around 350 kW, while the Tesla Model S could have a charging rate of up to 500 kW.

Overall, both the Audi e-tron GT and the Tesla Model S are expected to be well-suited for long-distance road trips in 2025, with improved range and faster charging capabilities compared to current models.",2025-06-04T01:43:30,f9096ba6-50bb-4608-8063-c1483f3bf06c,458afd0e-29a9-4262-b6d4-5e96127db0d4,cfc9e716-2760-4d83-9539-b0851476a243,https://autotrends.org/2025-electric-guide
prompt,How does the 2025 Tesla Model Y compare to the Audi e-tron in terms of battery range and charging speed?,2025-06-30T13:48:27,8ee56d54-0ed6-4b48-99de-3e193d8f5a3f,796ce0ad-996f-4519-84f9-656d62de5278,e1ac94de-21de-44f3-91e6-fb490d0b7233,
response,"In terms of battery range, the 2025 Tesla Model Y is expected to have a range of around 300-320 miles on a single charge, whereas the Audi e-tron currently has a range of around 220-240 miles. 

When it comes to charging speed, Tesla vehicles are known for their fast charging capabilities with their Supercharger network. The 2025 Model Y is expected to be able to charge at a rate of up to 300 kW, allowing for quicker charging times compared to the Audi e-tron, which has a maximum charging rate of around 150 kW. 

Overall, the 2025 Tesla Model Y is likely to have a longer battery range and faster charging speed compared to the Audi e-tron.",2025-06-30T13:49:46,1ad44ba4-3b54-471b-bf75-8334f39a1a1d,796ce0ad-996f-4519-84f9-656d62de5278,e1ac94de-21de-44f3-91e6-fb490d0b7233,
prompt,How does the electric range of the Tesla Model Y compare to the Audi e-tron in real-world driving conditions?,2025-06-07T20:04:37,bb7b0c00-d471-42af-b753-dd0a46b6fa25,cfa81b4f-4a5a-483c-b2aa-4ef2fd56d884,02c96c3e-3fdb-4e52-8c76-bf3c22f2dd69,
response,"In real-world driving conditions, the Tesla Model Y generally has a longer electric range compared to the Audi e-tron. The Model Y typically has a range of around 326 miles on a full charge, while the Audi e-tron has a range of around 220 miles. This difference is due to several factors including the efficiency of the electric motors, battery size, and overall vehicle weight. However, it is important to note that driving conditions, such as speed, terrain, and weather, can all affect the actual range of both vehicles.",2025-06-07T20:06:36,b19217ac-f063-41b1-a78b-f498d1b46ead,cfa81b4f-4a5a-483c-b2aa-4ef2fd56d884,02c96c3e-3fdb-4e52-8c76-bf3c22f2dd69,https://cars.ai/news/top-picks
prompt,How does the electric range of the 2025 Tesla Model 3 compare to the Chevrolet Bolt EUV in real-world driving conditions?,2025-06-13T16:44:23,910a5c7b-56e6-4daf-b7fc-6edf1b73367e,eb73f5ba-3b4f-40b7-9b8a-33a19d15257b,95bb0e71-304f-48c9-b132-3c273ca34f68,
response,"As of now, there is no official information available about the specific electric range of the 2025 Tesla Model 3. However, the current 2022 Tesla Model 3 Long Range has an EPA-rated range of 334 miles per charge. 

On the other hand, the Chevrolet Bolt EUV has an EPA-rated electric range of 247 miles per charge.

In real-world driving conditions, factors such as driving habits, weather, road conditions, and speed can all affect the actual range of an electric vehicle. Generally speaking, Tesla vehicles tend to have longer ranges and better efficiency compared to other electric vehicles, so it is likely that the 2025 Tesla Model 3 will have a higher electric range than the Chevrolet Bolt EUV in real-world driving scenarios.",2025-06-13T16:45:42,a0006764-3e1b-40a7-96b8-816b7e98e4f0,eb73f5ba-3b4f-40b7-9b8a-33a19d15257b,95bb0e71-304f-48c9-b132-3c273ca34f68,https://reviewauto2025.com/hybrids;https://autotrends.org/2025-electric-guide
prompt,"How does the 2025 Tesla Model 3 compare to the BMW i4 in terms of range, charging capabilities, and overall driving experience?",2025-06-19T08:56:11,b5802010-9021-4898-bf5f-4270ba2e61b3,b1e8ee9a-0750-44a7-91e5-4f423c6eb383,2f57e385-0316-41fa-8e73-e18a76d5c7c3,
response,"As of now, the 2025 Tesla Model 3 and the BMW i4 have not been released, so specific comparisons are not yet possible. However, based on the current models and trends in the electric vehicle market, we can make some general predictions.

In terms of range, Tesla has typically been ahead of the competition with longer ranges on a single charge. The 2025 Tesla Model 3 is likely to have a range of around 300-350 miles, while the BMW i4 is expected to have a range of around 250-300 miles. 

When it comes to charging capabilities, Tesla's Supercharger network is one of the most extensive and fastest charging networks available for electric vehicles. The 2025 Tesla Model 3 is expected to have fast charging capabilities that can add up to 150 miles of range in just 15 minutes. The BMW i4 is also expected to have fast charging capabilities, but it may not be as fast or as widely available as Tesla's Superchargers.

In terms of overall driving experience, both Tesla and BMW are known for producing high-quality, high-performance electric vehicles. The Tesla Model 3 is known for its quick acceleration, responsive handling, and smooth ride. The BMW i4 is also expected to offer a sporty driving experience with precise handling and a comfortable ride.

Ultimately, the choice between the 2025 Tesla Model 3 and the BMW i4 will likely come down to personal preference, as both are expected to offer impressive performance, range, and charging capabilities.",2025-06-19T08:57:41,f216bbb3-e9da-42d7-b2a3-b56c84a75b2f,b1e8ee9a-0750-44a7-91e5-4f423c6eb383,2f57e385-0316-41fa-8e73-e18a76d5c7c3,
prompt,"How does the range and performance of the Toyota Prius Prime compare to the Tesla Model 3 in 2025, considering advancements in battery technology and electric drivetrain efficiency over the years?",2025-06-17T10:19:39,2440704c-2645-47dd-a03e-f1eaf8a68af2,0631b623-c22e-44ab-848f-4ee4a00f6056,493daca6-efe3-42ed-b74b-0069883e2317,
response,"As of 2025, advancements in battery technology and electric drivetrain efficiency have likely improved the range and performance of both the Toyota Prius Prime and Tesla Model 3. The range of the Tesla Model 3 is expected to exceed that of the Toyota Prius Prime, as Tesla has been known for pushing the boundaries in electric vehicle technology.

The Toyota Prius Prime, with its plug-in hybrid technology, may have a total range of around 600 miles, combining its electric range and gasoline backup. The Tesla Model 3, on the other hand, could have a range of over 400 miles on a single charge, thanks to advancements in battery technology.

In terms of performance, the Tesla Model 3 is likely to remain superior to the Toyota Prius Prime due to its all-electric drivetrain. The Model 3's acceleration, handling, and overall driving dynamics are expected to be more impressive than those of the Prius Prime.

Overall, while both vehicles will see improvements in range and performance in 2025, the Tesla Model 3 is likely to maintain its edge over the Toyota Prius Prime in terms of electric range and overall driving experience.",2025-06-17T10:20:57,41b54dba-0730-4594-a86d-1329950f5fa0,0631b623-c22e-44ab-848f-4ee4a00f6056,493daca6-efe3-42ed-b74b-0069883e2317,https://cars.ai/news/top-picks
prompt,How does the Tesla Model 3 Performance compare to the Porsche Taycan in terms of acceleration and range in 2025?,2025-06-15T11:38:08,4fd6ac46-b897-4181-a60f-dad575702dd1,f451ea0a-d64e-4c68-bcdf-78fa5d2454fb,2b8518e1-74cf-4f58-ab5f-54461f4a2ad2,
response,"In 2025, the Tesla Model 3 Performance may still have an advantage in terms of acceleration compared to the Porsche Taycan. The Model 3 Performance is known for its impressive acceleration, with a 0-60 mph time of around 3.2 seconds. The Porsche Taycan, on the other hand, is also known for its quick acceleration, with a similar 0-60 mph time.

In terms of range, the Tesla Model 3 Performance is likely to have an advantage over the Porsche Taycan in 2025. Tesla vehicles are known for their industry-leading range, and the Model 3 Performance is no exception, with an estimated range of around 310 miles on a single charge. The Porsche Taycan, while still offering decent range, may fall slightly short of the Model 3 Performance in this regard.

Overall, both the Tesla Model 3 Performance and the Porsche Taycan are high-performance electric vehicles with impressive acceleration and range capabilities. The choice between the two will ultimately depend on individual preferences for brand, design, and driving experience.",2025-06-15T11:39:11,cb74e74f-a6c7-4549-932c-c30e52251e26,f451ea0a-d64e-4c68-bcdf-78fa5d2454fb,2b8518e1-74cf-4f58-ab5f-54461f4a2ad2,https://cars.ai/news/top-picks
prompt,How does the fuel efficiency of the Tesla Model 3 compare to the Chevrolet Bolt EV in real-world driving conditions in 2025?,2025-06-09T01:03:52,0cb5813d-ab2f-4a7c-b0a2-99d33c548227,85918d87-8edd-45b6-b4e9-a917674830e4,de2c43a9-9492-44b4-83f1-5f5cdd9b6620,
response,"The fuel efficiency of electric vehicles like the Tesla Model 3 and Chevrolet Bolt EV is typically measured in terms of miles per kilowatt-hour (kWh) of electricity consumed. In real-world driving conditions, the efficiency of these vehicles can vary based on factors such as driving habits, weather conditions, and terrain.

In 2025, it is likely that both the Tesla Model 3 and Chevrolet Bolt EV will continue to improve their efficiency through advancements in battery technology and vehicle design. It is difficult to predict exactly how the fuel efficiency of these two vehicles will compare in 2025, but both companies are likely to continue pushing the boundaries of electric vehicle technology to maximize range and efficiency.

Overall, both the Tesla Model 3 and Chevrolet Bolt EV are expected to offer competitive fuel efficiency in 2025, with the Tesla Model 3 potentially having a slight edge due to Tesla's focus on performance and range optimization. Ultimately, the best way to determine the fuel efficiency of these vehicles in real-world driving conditions in 2025 would be to consult independent reviews and test drives.",2025-06-09T01:05:23,5a637c16-5789-4282-9f52-9817f869712b,85918d87-8edd-45b6-b4e9-a917674830e4,de2c43a9-9492-44b4-83f1-5f5cdd9b6620,https://cars.ai/news/top-picks;https://carbuzz.net/battery-comparison
prompt,"How does the upcoming 2025 Tesla Model Y stack up against the Audi e-tron in terms of range, charging capabilities, and overall driving experience?",2025-06-20T19:26:34,de4750fe-2071-4c8b-9c34-3e2bb957b849,9e4160c4-b3f4-4f1e-865a-344e84cbd2b3,4af390f7-4f7c-4a64-b5d9-06d729379043,
response,"It is difficult to make a direct comparison between the 2025 Tesla Model Y and the Audi e-tron as the specific details and specifications of the 2025 Tesla Model Y have not been released yet. However, based on the current information available, we can provide a general comparison.

Range:
The Audi e-tron currently has a range of around 204 miles on a single charge. Tesla's vehicles are known for their long-range capabilities, so it is expected that the 2025 Tesla Model Y will have a longer range than the Audi e-tron. The current Tesla Model Y has a range of up to 326 miles on a single charge, so the 2025 version may have even better range.

Charging capabilities:
Tesla has an extensive Supercharger network that allows for fast charging across the country, making long-distance travel more convenient. Audi also has a network of fast chargers but it is not as extensive as Tesla's. It is likely that the 2025 Tesla Model Y will continue to have fast-charging capabilities through the Supercharger network.

Overall driving experience:
Tesla vehicles are known for their impressive acceleration, handling, and overall driving experience. The 2025 Tesla Model Y is expected to continue this trend with improvements in performance and technology. Audi vehicles are also known for their luxurious interiors and comfortable ride quality, so the Audi e-tron provides a more traditional luxury driving experience.

In conclusion, the 2025 Tesla Model Y is expected to have better range, faster charging capabilities, and a more advanced driving experience compared to the Audi e-tron. However, the Audi e-tron may offer a more luxurious and comfortable driving experience. Ultimately, the choice between the two vehicles will depend on individual preferences and priorities.",2025-06-20T19:27:56,018b89a9-4c6c-4553-ac16-9e1b2d750354,9e4160c4-b3f4-4f1e-865a-344e84cbd2b3,4af390f7-4f7c-4a64-b5d9-06d729379043,https://carbuzz.net/battery-comparison
prompt,How does the acceleration of the Tesla Model 3 Performance compare to the Audi e-tron GT in 2025?,2025-06-29T03:20:29,bad2360e-731e-4175-8e1b-c47257f201af,11db2bd7-7b07-4bba-af18-882c67b4f06c,3bb3ed82-26dc-4c49-ba8b-865755dc9651,
