content_type,content,created_at,content_id,machine_id,chat_group_id,sources
prompt,"How does the Tesla Model 3 compare to the Audi e-tron GT in terms of range, charging speed, and overall driving experience for long-distance road trips in 2025?",2025-06-18T13:24:34,dbb51b38-ca25-4599-b90c-f6aebeeff3d0,b87213c0-a97b-4f68-a0bc-8409a0d7eb66,f19b6887-a24c-490e-beee-ce110bd02e71,
response,"In 2025, the Tesla Model 3 may have a higher range compared to the Audi e-tron GT, as Tesla is known for constantly improving its battery technology. The Model 3 already has a range of up to 353 miles, while the Audi e-tron GT has a range of around 238 miles. 

When it comes to charging speed, Tesla's Supercharger network is known for its fast charging speeds, allowing Tesla vehicles to charge quickly along long-distance road trips. The Audi e-tron GT may have access to fast charging infrastructure, but it may not be as widespread or as fast as Tesla's Supercharger network.

In terms of overall driving experience for long-distance road trips, both the Tesla Model 3 and Audi e-tron GT offer a comfortable and luxurious driving experience. However, the Tesla Model 3 is known for its smooth acceleration and handling, which may make it more enjoyable to drive on long road trips. The Audi e-tron GT, on the other hand, offers a more refined and luxurious interior, which may appeal to some drivers for long-distance driving comfort. 

Overall, both the Tesla Model 3 and Audi e-tron GT are capable electric vehicles for long-distance road trips in 2025, but the Tesla Model 3 may have the edge in terms of range, charging speed, and overall driving experience.",2025-06-18T13:25:31,e2f7f9ce-da49-4524-9141-4416b088d320,b87213c0-a97b-4f68-a0bc-8409a0d7eb66,f19b6887-a24c-490e-beee-ce110bd02e71,https://carbuzz.net/battery-comparison
prompt,How does the anticipated 2025 Chevrolet Silverado Electric stack up against the established Ford F-150 Lightning in terms of towing capacity and range on a single charge?,2025-06-05T18:56:59,84728ca0-0349-454d-b499-ad0ea3e4fb81,5ffa7790-7287-4dc7-a9a4-9a56a3e5fe40,aa646232-23d7-435f-8fde-ae897b794d3e,
response,"As of now, the anticipated towing capacity and range for the 2025 Chevrolet Silverado Electric have not been officially released. However, General Motors has stated that they are targeting a competitive towing capacity and range for the Silverado Electric.

The Ford F-150 Lightning, on the other hand, has a targeted towing capacity of up to 10,000 pounds and a range of up to 300 miles on a single charge. These figures make the F-150 Lightning one of the most capable electric trucks in terms of towing capacity and range.

Without specific details on the Silverado Electric's towing capacity and range, it is difficult to directly compare the two trucks. However, based on the performance targets set by both manufacturers, it is likely that the Silverado Electric will be competitive with the F-150 Lightning in terms of towing capacity and range on a single charge. Ultimately, consumers will have to wait for official figures to be released to make a definitive comparison between the two electric trucks.",2025-06-05T18:57:41,10e6e32b-601c-455f-b6d0-20a6cf4f73ee,5ffa7790-7287-4dc7-a9a4-9a56a3e5fe40,aa646232-23d7-435f-8fde-ae897b794d3e,
prompt,How does the range of the Tesla Model Y compare to the Audi e-tron GT in real-world driving conditions in 2025?,2025-06-24T01:33:05,fbc11dd8-72a2-4ff1-a76d-ecd524de152f,dca6abac-180a-4473-8f1e-c6aca50b92ca,569da9bb-4642-4c5e-81e1-b38e6743de2b,
response,"In 2025, the range of the Tesla Model Y is expected to be around 300-350 miles on a single charge, depending on driving conditions and usage. The Audi e-tron GT, on the other hand, is expected to have a range of around 250-300 miles in real-world driving conditions.

Overall, the Tesla Model Y is likely to have a slightly longer range compared to the Audi e-tron GT in 2025, making it a more practical choice for long-distance drives without the need for frequent charging stops. However, both vehicles are likely to provide sufficient range for most daily driving needs.",2025-06-24T01:34:46,039cbe0f-b224-4b3a-bef1-e1ad20b361d2,dca6abac-180a-4473-8f1e-c6aca50b92ca,569da9bb-4642-4c5e-81e1-b38e6743de2b,https://reviewauto2025.com/hybrids
prompt,How does the Tesla Model Y compare to the BMW iX3 in terms of range and charging capabilities for long-distance road trips in 2025?,2025-06-14T11:23:22,bb5b45af-887b-43a2-a731-9a480f267ada,e25b519d-737f-4604-9fa2-e159247ccba3,15800003-742e-4b5f-bcd9-7836a61ac6e7,
response,"In 2025, the Tesla Model Y and BMW iX3 will likely have advanced in terms of range and charging capabilities compared to their current models. 

The Tesla Model Y is known for its long range capabilities, with the current model offering up to 326 miles on a single charge. By 2025, it is possible that Tesla will have improved the Model Y's battery technology and efficiency, potentially increasing its range even further. Additionally, Tesla's extensive Supercharger network allows for fast charging along major routes, making long-distance road trips more convenient for Model Y owners.

On the other hand, the BMW iX3 is part of BMW's electric vehicle lineup and offers a respectable range of around 250 miles on a single charge. In 2025, BMW may have improved the iX3's battery technology and range capabilities, allowing for longer distances between charges. BMW also has its own network of fast chargers, which can provide quick charging options for iX3 owners on long road trips.

Overall, both the Tesla Model Y and BMW iX3 are likely to have improved range and charging capabilities by 2025, making them viable options for long-distance road trips. The decision between the two will ultimately depend on personal preferences, brand loyalty, and specific features offered by each vehicle.",2025-06-14T11:25:04,1ea1c9ee-80f8-4feb-8846-8bc36eb45402,e25b519d-737f-4604-9fa2-e159247ccba3,15800003-742e-4b5f-bcd9-7836a61ac6e7,https://carbuzz.net/battery-comparison
prompt,"How does the upcoming electric Ford Mustang Mach-E stack up against the Tesla Model Y in terms of range, charging speed, and overall performance for daily commuting and long road trips in 2025?",2025-06-29T22:08:51,255172ad-1015-415a-9a6d-b18c5360a2b6,de630b86-8f24-4193-9320-e49f3a256ff5,677b982b-e414-4362-9cb5-bacf89ebfa8f,
response,"As of 2025, the Ford Mustang Mach-E has made significant improvements in range, charging speed, and overall performance compared to the Tesla Model Y. Here's how they stack up:

Range:
- The Ford Mustang Mach-E is now equipped with the latest battery technology, allowing it to achieve a range of up to 400 miles on a single charge. This is a substantial improvement over previous models, making it a viable option for long road trips without worrying about range anxiety.
- The Tesla Model Y, on the other hand, offers a range of around 300 miles, which is still respectable but falls short of the Mach-E's capabilities.

Charging speed:
- Ford has invested heavily in expanding its charging infrastructure, and the Mustang Mach-E now supports fast charging speeds of up to 350 kW. This means that drivers can quickly top up their battery during long road trips, minimizing downtime and ensuring a smooth journey.
- Tesla's Supercharger network is still a major advantage, offering charging speeds of up to 250 kW. However, the Mach-E's faster charging speed gives it an edge when it comes to overall convenience and flexibility on the road.

Overall performance:
- The Ford Mustang Mach-E has been fine-tuned for optimal performance, with a responsive driving experience and impressive acceleration. Its electric powertrain delivers smooth power delivery and precise handling, making it a joy to drive on a daily basis.
- The Tesla Model Y is known for its quick acceleration and nimble handling, but the Mach-E's improvements in performance make it a strong competitor in this category as well. With a more refined driving experience and improved range, the Mach-E is a compelling choice for both daily commuting and long road trips.

Overall, the Ford Mustang Mach-E has made significant strides in range, charging speed, and overall performance, putting it on par with (and even surpassing) the Tesla Model Y in several key areas. Drivers looking for a reliable electric vehicle that can handle daily commuting and long road trips with ease should consider the Mach-E as a top contender in 2025.",2025-06-29T22:10:36,58ab697e-15a4-47bc-875a-a92e6369cc5a,de630b86-8f24-4193-9320-e49f3a256ff5,677b982b-e414-4362-9cb5-bacf89ebfa8f,
prompt,How does the acceleration and handling of the Tesla Model Y compare to the Audi e-tron in 2025?,2025-06-29T12:47:13,4b7b13a1-ee18-4e48-81ee-27eb472706f3,a2d41023-4eac-4ddb-89c2-a66f9fbc3986,efbad811-2924-4755-adb5-32452cfe7737,
response,"In 2025, the Tesla Model Y is known for its impressive acceleration and handling capabilities, as it features Tesla's advanced electric powertrain technology and innovative design. The Model Y is known for its quick acceleration and smooth handling, thanks to its dual motor all-wheel drive system and low center of gravity, which results in a responsive and dynamic driving experience.

On the other hand, the Audi e-tron is also a high-performance electric SUV that offers a smooth and refined driving experience. The e-tron features Audi's Quattro all-wheel drive system and advanced suspension technology, which provides excellent handling and stability on the road.

Overall, both the Tesla Model Y and Audi e-tron offer impressive acceleration and handling characteristics in 2025, with the Model Y potentially edging out the e-tron in terms of acceleration due to Tesla's reputation for producing powerful electric vehicles. However, both vehicles are likely to offer a high level of performance and driving dynamics for those looking for a premium electric SUV experience.",2025-06-29T12:48:44,ca95085e-4b39-4de6-a556-3f6c76569114,a2d41023-4eac-4ddb-89c2-a66f9fbc3986,efbad811-2924-4755-adb5-32452cfe7737,
prompt,"How does the acceleration and off-road capability of the 2025 Rivian R1T compare to the Dacia Spring, and which one offers a better range for long-distance driving?",2025-06-07T21:38:35,f15a3b57-809c-4a31-8d6f-73eadb542da3,7728aebb-63aa-4b34-ade1-c0d06b73d1ae,54130aa0-586c-4eaa-b6cb-b734d3821449,
response,"The 2025 Rivian R1T will likely offer superior acceleration and off-road capability compared to the Dacia Spring. The Rivian R1T is designed as an electric adventure truck with powerful electric motors and advanced off-road features, making it well-suited for off-road driving and delivering quick acceleration.

In terms of range for long-distance driving, the Rivian R1T is expected to offer a longer range compared to the Dacia Spring. The Rivian R1T will likely have a larger battery capacity and more efficient electric motors, allowing for a greater driving range on a single charge. This makes the Rivian R1T a better option for long-distance driving compared to the Dacia Spring.",2025-06-07T21:39:29,9a7643cf-bda2-4238-9e1a-6d20ce78f614,7728aebb-63aa-4b34-ade1-c0d06b73d1ae,54130aa0-586c-4eaa-b6cb-b734d3821449,https://cars.ai/news/top-picks;https://reviewauto2025.com/hybrids
prompt,How does the Tesla Model Y compare to the Audi e-tron in terms of range and charging capabilities for long road trips in 2025?,2025-06-30T23:41:20,3444872e-2cd9-4b80-b936-c664298f3cf5,faebbccd-5d44-4466-a313-aa48ce705773,0c36038c-f3ed-4198-97ea-622c20e4bba4,
response,"In 2025, the Tesla Model Y is expected to continue to outperform the Audi e-tron in terms of range and charging capabilities for long road trips. The Model Y currently has a range of up to 326 miles on a single charge, while the Audi e-tron has a range of up to 222-259 miles depending on the model.

In terms of charging capabilities, the Tesla Model Y is equipped with Tesla's Supercharger network, which is known for its fast charging speeds and wide availability. This network allows Model Y owners to rapidly charge their vehicles at convenient locations along major highways, making long road trips more convenient and efficient.

On the other hand, while the Audi e-tron is capable of fast charging with up to 150 kW DC charging, it does not have the same extensive network of charging stations as Tesla. This can make it more challenging for e-tron owners to find suitable charging options on long road trips.

Overall, the Tesla Model Y is likely to offer a more seamless and efficient experience for long road trips in 2025 due to its longer range and well-established Supercharger network.",2025-06-30T23:41:50,ab4db0a9-f413-4389-8f3a-b5011ecf46b1,faebbccd-5d44-4466-a313-aa48ce705773,0c36038c-f3ed-4198-97ea-622c20e4bba4,https://carbuzz.net/battery-comparison;https://cars.ai/news/top-picks
prompt,How does the acceleration of the Tesla Model Y compare with the Audi e-tron GT in 2025?,2025-06-01T18:17:29,3b8061fd-b269-48c2-83e2-426600655beb,fc95c59e-ded2-4ab5-b728-ee37a5bb27a0,6c7901ad-489c-48cc-8640-95a1699fa9cd,
response,"As of 2025, the Tesla Model Y is known for its impressive acceleration capabilities due to its electric powertrain. It is likely that the Model Y will have a quicker acceleration compared to the Audi e-tron GT, as Tesla vehicles are known for their quick acceleration times.

The Audi e-tron GT is also an electric vehicle that offers strong acceleration performance, but it may not be as quick as the Tesla Model Y. Audi vehicles are typically known for their luxury and comfort while Tesla vehicles are known for their speed and cutting-edge technology.

Overall, the Tesla Model Y is expected to have better acceleration compared to the Audi e-tron GT in 2025.",2025-06-01T18:18:15,a6f84b6e-3dd4-424c-afe5-c4c100bd4afe,fc95c59e-ded2-4ab5-b728-ee37a5bb27a0,6c7901ad-489c-48cc-8640-95a1699fa9cd,https://autotrends.org/2025-electric-guide;https://reviewauto2025.com/hybrids
prompt,How does the acceleration of the Tesla Model Y compare to the Audi e-tron GT in 2025?,2025-06-05T11:39:16,d7d1268c-e81d-4889-b248-742e24874efe,6389ef2e-7a4d-4f69-b209-3648f00cab7d,56e0c093-2278-47be-8ad5-9b68a0509ce3,
response,"In 2025, the acceleration of the Tesla Model Y is likely to be faster than that of the Audi e-tron GT. Tesla vehicles are known for their quick acceleration and the Model Y is no exception. The Audi e-tron GT is also a high-performance electric vehicle, but Tesla has a reputation for pushing the boundaries of acceleration and performance in its vehicles. Therefore, it is likely that the Tesla Model Y will have a faster acceleration than the Audi e-tron GT in 2025.",2025-06-05T11:39:54,9bdfa679-7e25-44f4-accb-21886f10bab8,6389ef2e-7a4d-4f69-b209-3648f00cab7d,56e0c093-2278-47be-8ad5-9b68a0509ce3,
prompt,"How does the all-electric BMW i4 stack up against the Tesla Model 3 in terms of range, charging speed, and overall driving experience for the 2025 model year?",2025-06-25T12:26:53,67850ebe-103e-469b-aed6-1f029898d8d7,6b9cd4c4-20f8-490f-b0ed-c5b5be66f68d,7c524cf1-b2f9-4235-949c-a94e84778a10,
response,"In order to compare the all-electric BMW i4 and the Tesla Model 3 for the 2025 model year in terms of range, charging speed, and overall driving experience, we would need to look at the specifications provided by the manufacturers at that time.

Range: The range of an electric vehicle is an important factor for many buyers. The BMW i4 is expected to have a range of around 300 miles on a single charge, while the Tesla Model 3 currently offers a range of up to 353 miles for the Long Range model. The Tesla Model 3 may have an advantage in terms of range based on current specifications, but it's important to note that battery technology is constantly evolving.

Charging speed: Charging speed is also a crucial factor for electric vehicle owners. The BMW i4 is likely to support fast-charging capabilities, which can provide a significant amount of range in a short amount of time. The Tesla Model 3 is known for its fast Supercharging network, which allows drivers to recharge quickly while on the go. It is possible that both models could offer similar charging speeds in the future, but it would depend on the specific charging technology used by each manufacturer.

Overall driving experience: The driving experience of an electric vehicle is influenced by factors such as performance, handling, and technology features. The BMW i4 is expected to offer a luxurious driving experience with advanced technology and high-quality materials. The Tesla Model 3 is known for its responsive acceleration, precise handling, and user-friendly tech features like Autopilot. Both models are likely to provide a comfortable and enjoyable driving experience, but personal preferences and priorities may vary.

Ultimately, the choice between the BMW i4 and the Tesla Model 3 for the 2025 model year will depend on individual preferences and priorities. It's important to consider factors such as range, charging speed, driving experience, and overall value when making a decision between these two all-electric vehicles.",2025-06-25T12:28:08,bcc13275-eb20-476c-94ab-da12f7068f84,6b9cd4c4-20f8-490f-b0ed-c5b5be66f68d,7c524cf1-b2f9-4235-949c-a94e84778a10,https://carbuzz.net/battery-comparison;https://reviewauto2025.com/hybrids
prompt,How does the electric range of the Tesla Model Y compare to the Audi e-tron GT for long-distance road trips in 2025?,2025-06-20T05:57:48,7f96d306-3dd2-4e92-aec9-4797e482eb5b,7b9c0b9f-dd45-4597-a1a1-9295a8a5b59b,3d7f6121-6469-4d8e-91c5-d9c104425bec,
response,"As of now, in 2025, the Tesla Model Y has an estimated electric range of around 300 miles on a full charge, while the Audi e-tron GT has an estimated electric range of around 250 miles on a full charge. 

Therefore, for long-distance road trips, the Tesla Model Y would likely be able to travel further on a single charge compared to the Audi e-tron GT. This means that the Model Y may require fewer stops for charging, and overall provide a more convenient experience for long road trips. 

It's important to note that electric vehicle technology is constantly evolving, so it's possible that these ranges may change in the future as new advancements are made.",2025-06-20T05:58:47,812b308c-03c2-46dd-9fd0-33450875cdcf,7b9c0b9f-dd45-4597-a1a1-9295a8a5b59b,3d7f6121-6469-4d8e-91c5-d9c104425bec,https://cars.ai/news/top-picks;https://reviewauto2025.com/hybrids
prompt,"How does the electric range of the Tesla Model 3 compare to the Audi e-tron GT in city driving conditions, and which one offers better handling and acceleration for urban commutes in 2025?",2025-06-09T19:56:50,62708414-64e7-4136-8f24-47bf107aeb35,56caf62a-13ee-4f33-8cb9-8bb15dc73ab2,916d093a-8533-4dde-bf5a-ecf8bf97a19b,
response,"As of 2025, the electric range of the Tesla Model 3 in city driving conditions is typically around 220-250 miles on a single charge, depending on the specific model and battery configuration. On the other hand, the Audi e-tron GT has an estimated electric range of around 200-220 miles in city driving conditions.

In terms of handling and acceleration for urban commutes, the Tesla Model 3 is known for its sharp handling and impressive acceleration thanks to its low center of gravity and instant torque delivery from its electric motors. The Model 3 is also praised for its nimble and agile performance, making it well-suited for city driving where quick acceleration and responsive handling are key.

On the other hand, the Audi e-tron GT offers a more luxurious and refined driving experience, with a focus on comfort and smooth performance. While the e-tron GT may not be as sporty or agile as the Model 3, it still provides a comfortable and pleasant driving experience for urban commutes.

Overall, both the Tesla Model 3 and Audi e-tron GT have their own strengths and characteristics that make them suitable for urban commuting in 2025. The Model 3 may offer better handling and acceleration for those looking for a sportier driving experience, while the e-tron GT provides a more refined and comfortable ride for city driving. Ultimately, the choice between the two will depend on the individual preferences and priorities of the driver.",2025-06-09T19:58:19,eca5c8db-7dd6-45d4-a7a7-a77d545db5f9,56caf62a-13ee-4f33-8cb9-8bb15dc73ab2,916d093a-8533-4dde-bf5a-ecf8bf97a19b,https://cars.ai/news/top-picks;https://autotrends.org/2025-electric-guide
prompt,"How does the battery range of the Tesla Model Y compare to the Audi e-Tron Sportback in real-world driving conditions, such as city commuting and highway cruising, by the year 2025?",2025-06-18T11:54:31,aa7454d1-4b24-4b2c-8c67-31348326ef9f,052bdfca-0856-4925-82eb-742b15c09d20,20bf3cb6-cad9-420e-8c80-9702fb03294c,
response,"As of 2025, it is difficult to predict the exact battery range of the Tesla Model Y and the Audi e-Tron Sportback in real-world driving conditions. However, based on the current trends in electric vehicle technology, it is likely that both vehicles will continue to improve their battery efficiency and range over the next few years.

Generally, the Tesla Model Y has a longer range compared to the Audi e-Tron Sportback. The Model Y is known for its impressive range, with the Long Range version currently offering around 326 miles on a single charge. The Audi e-Tron Sportback, on the other hand, has a range of around 218 miles.

In terms of city commuting, the Tesla Model Y may have the upper hand due to its more efficient battery system and regenerative braking technology. City driving typically allows for more opportunities to regenerate energy through braking, which can help extend the range of electric vehicles.

On the highway, both vehicles may see a slight decrease in range due to higher speeds and increased energy consumption. However, the Tesla Model Y may still have an advantage in this scenario, as it is known for its aerodynamic design and superior efficiency.

Overall, by 2025, it is likely that both the Tesla Model Y and the Audi e-Tron Sportback will have improved their battery range and performance. The Tesla Model Y may continue to offer a longer range and better efficiency, making it a more attractive option for both city commuting and highway cruising.",2025-06-18T11:55:38,4f347b8d-d1d1-4714-8dbc-902c878bd777,052bdfca-0856-4925-82eb-742b15c09d20,20bf3cb6-cad9-420e-8c80-9702fb03294c,
prompt,How does the 2025 Tesla Model Y compare to the Audi e-tron in terms of range and charging capabilities?,2025-06-04T14:42:51,5ee3aee9-4d44-45a2-8b6d-ccac51827700,c44b04a9-4e85-4526-bd7e-c322977bbd34,0ec8006f-24e7-4606-a4dd-b8544f5f622c,
response,"Based on current information, the 2025 Tesla Model Y is expected to have a longer range and faster charging capabilities compared to the Audi e-tron. 

The Tesla Model Y is projected to have a range of around 300 miles on a single charge, while the Audi e-tron currently has a range of about 200-220 miles. Additionally, Tesla's Supercharger network allows for fast charging speeds, with the ability to add up to 150 miles of range in just 15 minutes. In comparison, the Audi e-tron takes longer to charge and does not have access to a similar extensive fast-charging network.

Overall, the Tesla Model Y is expected to have superior range and charging capabilities compared to the Audi e-tron in 2025.",2025-06-04T14:43:44,02b5dc08-d8cc-4e76-af09-6976ca87e29f,c44b04a9-4e85-4526-bd7e-c322977bbd34,0ec8006f-24e7-4606-a4dd-b8544f5f622c,https://cars.ai/news/top-picks;https://autotrends.org/2025-electric-guide
prompt,"How does the upcoming Tesla Model Y compare to the Audi e-tron in terms of range, acceleration, and overall performance for the 2025 model year?",2025-06-18T11:12:16,41b7d4fa-ec16-4e03-9662-017fc1d47085,be224a46-d959-4be6-82c9-f938555743b1,55734642-01f9-43a0-ae96-c793af899934,
response,"As an AI language model, I am unable to provide real-time or future information. However, I can provide some general comparisons based on the current information available as of 2021.

As of now, the Tesla Model Y and Audi e-tron have different specifications in terms of range, acceleration, and overall performance. 

The current Tesla Model Y has a range of up to 326 miles (for the Long Range Dual Motor version) and can accelerate from 0 to 60 mph in as fast as 4.8 seconds (for the Performance version). On the other hand, the Audi e-tron has a range of up to 222 miles and can accelerate from 0 to 60 mph in about 5.5 seconds.

In terms of overall performance, Tesla vehicles are known for their quick acceleration and agile handling due to their electric powertrains and low center of gravity. Audi, on the other hand, is known for its luxury and comfort features.

For the 2025 model year, it is expected that both Tesla and Audi will continue to improve their electric vehicles with advancements in battery technology, range, acceleration, and overall performance. It is likely that the Tesla Model Y will continue to have a longer range and quicker acceleration compared to the Audi e-tron, but it will ultimately depend on the specific improvements made by each automaker.",2025-06-18T11:13:14,0d58fd4c-62e5-4514-a381-65bdd103e05c,be224a46-d959-4be6-82c9-f938555743b1,55734642-01f9-43a0-ae96-c793af899934,
prompt,How does the predicted range of the Tesla Model S compare to the upcoming Audi e-tron GT in 2025?,2025-06-16T07:35:35,85d4a660-2d62-4408-b250-0125c9aa3e7b,cadb3bd8-4e8b-44b8-a15a-5e0ce1c4b3df,eaabdecd-6bf3-4cc5-aa39-d1de52623cd7,
