content_type,content,created_at,content_id,machine_id,chat_group_id,sources
response,"As of 2025, the Tesla Model Y is expected to have a longer battery range compared to the Audi e-tron. Tesla has consistently been ahead of the competition in terms of range thanks to their advanced battery technology and efficiency. The Model Y is expected to have a range of around 400 miles on a single charge, while the Audi e-tron typically has a range of around 200-250 miles.

In terms of performance, the two vehicles are likely to be similar in terms of acceleration and handling, with both cars offering powerful electric drive trains and responsive handling. However, Tesla vehicles are known for their ""Ludicrous Mode"" acceleration, which can outpace many other electric vehicles on the market.

Overall, the Tesla Model Y is likely to have a longer range and potentially better performance compared to the Audi e-tron for the 2025 model year. However, the Audi e-tron is known for its luxurious interior and high-end features, so it may still appeal to buyers looking for a more premium electric SUV option.",2025-06-23T11:12:14,95e6a8aa-fe0b-4e96-97fc-2bee929f18bc,62159cef-fce7-4cb9-b5a9-320aa47c5c4d,96ab0252-c3ff-43b4-9245-48345ef20b96,https://autotrends.org/2025-electric-guide
prompt,How does the Tesla Model Y compare to the Audi Q4 e-tron in terms of range and acceleration for the 2025 model year?,2025-06-29T02:28:30,58f5031d-1dd0-45a9-a760-e9c3dae31df1,d6e1e194-0e9d-4ace-b270-19e96f910dc3,6d4c38d7-99de-4126-8b90-2682a17ec7dd,
response,"As of now (2021), it's difficult to predict the exact specifications for the 2025 model year of the Tesla Model Y and Audi Q4 e-tron. However, based on the current models, we can make some general comparisons.

In terms of range, the Tesla Model Y currently offers one of the longest ranges of any electric vehicle on the market, with the Long Range version offering an EPA estimated range of around 326 miles. The Audi Q4 e-tron, on the other hand, has an estimated range of around 260 miles. 

When it comes to acceleration, the Tesla Model Y is known for its quick acceleration, with the Performance version able to go from 0-60 mph in just 3.5 seconds. The Audi Q4 e-tron, while still offering good acceleration for an electric vehicle, is not quite as quick as the Tesla Model Y.

For the 2025 model year, it's possible that both vehicles could see improvements in range and acceleration, as technology continues to advance in the electric vehicle space. It's best to wait for official announcements from Tesla and Audi closer to the 2025 model year to get the most accurate information.",2025-06-29T02:30:07,2d3bccd6-bf57-4fc0-ad0b-9d71bccf7aba,d6e1e194-0e9d-4ace-b270-19e96f910dc3,6d4c38d7-99de-4126-8b90-2682a17ec7dd,https://autotrends.org/2025-electric-guide
prompt,How does the electric range of the Tesla Model 3 compare to the Volkswagen ID.4 in real-world driving conditions in 2025?,2025-06-08T13:19:24,b9bccbd6-4a2d-4386-8cfd-d50fa6a8dd60,d942b7e3-8b8e-4864-84f7-f22211231436,88840add-44d4-453a-827f-396ca26555e3,
response,"In 2025, the electric range of the Tesla Model 3 and the Volkswagen ID.4 may have evolved due to advancements in battery technology and other factors. However, as of now, the Tesla Model 3 has a slightly higher range compared to the Volkswagen ID.4 in real-world driving conditions.

The Tesla Model 3 currently has a range of around 250-350 miles, depending on the variant and driving conditions. On the other hand, the Volkswagen ID.4 has a range of around 200-250 miles in real-world driving conditions.

It is likely that both manufacturers will continue to improve the range of their electric vehicles in the coming years. Therefore, it is possible that by 2025, the range of both the Tesla Model 3 and the Volkswagen ID.4 could be even higher and more comparable to each other.",2025-06-08T13:20:38,d2695d5c-31e9-4076-acac-e0d0b86fd053,d942b7e3-8b8e-4864-84f7-f22211231436,88840add-44d4-453a-827f-396ca26555e3,https://carbuzz.net/battery-comparison
prompt,How does the range and acceleration of the Tesla Model Y compare to the Audi e-tron GT in 2025?,2025-06-21T16:41:23,5a7dbafb-faca-41c0-b8b3-6a2e7d88d6ac,36aa227a-4723-47f3-8931-e0f2492bc6cf,8a33d73b-2d07-4bb6-8120-e1485f7cc8e1,
response,"In 2025, the Tesla Model Y is likely to have a better range and acceleration compared to the Audi e-tron GT. Tesla vehicles are known for their industry-leading range and acceleration due to their advanced battery technology and electric drivetrains. The Model Y is expected to have a range of around 350-400 miles on a single charge and acceleration from 0-60 mph in under 4 seconds.

On the other hand, the Audi e-tron GT is also a high-performance electric vehicle but may not have the same level of range and acceleration as the Tesla Model Y. The e-tron GT is expected to have a range of around 250-300 miles and acceleration from 0-60 mph in around 4 seconds.

Overall, the Tesla Model Y is likely to offer better range and acceleration compared to the Audi e-tron GT in 2025.",2025-06-21T16:43:16,93345211-0d47-4e60-a624-33e003b2511c,36aa227a-4723-47f3-8931-e0f2492bc6cf,8a33d73b-2d07-4bb6-8120-e1485f7cc8e1,
prompt,How does the 2025 Tesla Model S Plaid compare to the Porsche Taycan Turbo S in terms of acceleration and overall driving range?,2025-06-03T17:38:37,8a126172-948b-44fc-bc86-3d552eb0cf7d,acc54178-5e4d-43c9-9145-d29828212e17,8b13ee33-c1ca-47ef-89d5-6452b926114b,
response,"The 2025 Tesla Model S Plaid is expected to have an impressive acceleration time of 0-60 mph in less than 2 seconds, making it one of the fastest accelerating production cars in the world. In comparison, the Porsche Taycan Turbo S has an acceleration time of 0-60 mph in 2.6 seconds, which is still quite impressive but not as quick as the Tesla Model S Plaid.

In terms of driving range, the 2025 Tesla Model S Plaid is expected to have a range of around 520 miles on a single charge, making it one of the longest-range electric vehicles on the market. The Porsche Taycan Turbo S, on the other hand, has a range of around 192 miles on a single charge, which is significantly lower than the Tesla Model S Plaid.

Overall, the 2025 Tesla Model S Plaid outperforms the Porsche Taycan Turbo S in terms of acceleration and driving range, making it a more impressive and high-performing electric vehicle option.",2025-06-03T17:40:33,63c0bf9f-59d8-40f5-8d91-f0c445142da4,acc54178-5e4d-43c9-9145-d29828212e17,8b13ee33-c1ca-47ef-89d5-6452b926114b,https://autotrends.org/2025-electric-guide
prompt,How does the Tesla Model Y compare to the Audi e-tron in terms of range and charging speed for long-distance road trips in 2025?,2025-06-14T10:12:44,c4884a49-9d64-49b8-b48d-a44262d9d6ef,77ab547a-c024-4af6-aa3c-15c9f7c093c2,f53d77c1-5faa-4278-94b3-0b9c006c3617,
response,"In 2025, it is likely that the Tesla Model Y will have a longer range and faster charging speed compared to the Audi e-tron. Tesla has been a leader in electric vehicle technology and range for many years, and it is expected that they will continue to push the boundaries in terms of range and charging speed for their vehicles.

The Tesla Model Y currently has a range of around 326 miles on a single charge, while the Audi e-tron has a range of around 222 miles. It is likely that by 2025, the Tesla Model Y will have a range exceeding 400 miles, while the Audi e-tron may see a slight improvement in range but still not reach the level of the Tesla.

In terms of charging speed, Tesla vehicles are known for their fast charging capabilities with their Supercharger network. It is likely that by 2025, Tesla will have even faster charging speeds, allowing for quicker pit stops on long-distance road trips. The Audi e-tron may also see improvements in charging speed, but it is unlikely to match the speed and convenience of Tesla's Supercharger network.

Overall, for long-distance road trips in 2025, the Tesla Model Y is likely to be the superior choice compared to the Audi e-tron in terms of range and charging speed.",2025-06-14T10:13:33,adf683bb-4021-40df-ba01-9979802cde0e,77ab547a-c024-4af6-aa3c-15c9f7c093c2,f53d77c1-5faa-4278-94b3-0b9c006c3617,
prompt,How does the fuel efficiency of the Toyota Prius compare to the Tesla Model 3 in the year 2025?,2025-06-16T05:24:25,0d939b7d-b3f6-4f54-b5ca-b013ff18419f,3ddc61ee-e1c7-4f9a-946c-07cc7422396a,f397f96d-19c0-409d-94d3-925871877e5d,
response,"As of 2025, the Toyota Prius is a hybrid vehicle known for its excellent fuel efficiency, typically achieving around 50-60 miles per gallon. On the other hand, the Tesla Model 3 is a fully electric vehicle that does not rely on gasoline and instead runs on electricity.

In terms of fuel efficiency, the Tesla Model 3 has an advantage over the Toyota Prius as it does not use any gasoline at all. The Model 3 can achieve the equivalent of over 100 miles per gallon in terms of energy efficiency. Additionally, electric vehicles like the Model 3 are more environmentally friendly as they produce zero emissions.

Overall, while both the Toyota Prius and Tesla Model 3 are known for their fuel efficiency, the Tesla Model 3 has the edge in terms of energy efficiency and environmental impact as of 2025.",2025-06-16T05:26:15,c38a9155-a272-46f3-9fde-103c3b04e619,3ddc61ee-e1c7-4f9a-946c-07cc7422396a,f397f96d-19c0-409d-94d3-925871877e5d,https://carbuzz.net/battery-comparison;https://autotrends.org/2025-electric-guide
prompt,How does the 2025 Ford Mustang Mach-E compare to the Rivian R1S in terms of battery range and towing capacity?,2025-06-06T09:30:49,481085ad-ec08-4f80-b8e4-241ee8206429,fabc8ebe-178f-4a16-9c2a-65261772e744,6fd4b2a3-90eb-403d-b089-b9fc335f5655,
response,"The 2025 Ford Mustang Mach-E and the Rivian R1S are both electric vehicles with impressive battery ranges and towing capacities. 

In terms of battery range, the 2025 Ford Mustang Mach-E offers multiple battery options ranging from a standard range of around 230 miles to an extended range of over 300 miles. On the other hand, the Rivian R1S is known for its longer battery range, with the highest trim level offering a range of up to 410 miles on a single charge.

As for towing capacity, the 2025 Ford Mustang Mach-E has a maximum towing capacity of up to 3,500 pounds when properly equipped. In comparison, the Rivian R1S has a much higher towing capacity of up to 7,700 pounds, making it a better option for those who require more towing capability.

Overall, the Rivian R1S has a superior battery range and towing capacity compared to the 2025 Ford Mustang Mach-E. However, the Mach-E may still be a suitable option for those looking for a more affordable electric vehicle with decent range and towing capabilities.",2025-06-06T09:32:36,89174455-aaa4-4f8c-9cd0-38a8321cec6c,fabc8ebe-178f-4a16-9c2a-65261772e744,6fd4b2a3-90eb-403d-b089-b9fc335f5655,https://cars.ai/news/top-picks
prompt,"How does the Tesla Model Y compare to the Audi e-tron in terms of range, acceleration, and overall performance for the 2025 model year?",2025-06-27T19:48:28,adcad04b-79c6-4e84-ae20-c9312efd4769,244bf9af-d5e1-4e30-a44f-2183401c4c75,334fadaa-e70b-4090-a312-40eed179586a,
response,"In 2025, the Tesla Model Y is likely to have a longer range and better acceleration compared to the Audi e-tron. Tesla vehicles are known for their impressive range, and with advancements in battery technology, the Model Y could offer even greater range than the Audi e-tron.

In terms of acceleration, Tesla vehicles are also known for their quick acceleration thanks to their electric motors. The Model Y is expected to have quicker acceleration compared to the Audi e-tron.

Overall performance is subjective and can depend on individual preferences. However, Tesla vehicles are typically known for their sporty performance and handling, while Audi vehicles are often praised for their comfort and luxury features. The Model Y may offer a more engaging driving experience compared to the Audi e-tron.

Overall, the Tesla Model Y is likely to have a larger range, quicker acceleration, and a more engaging driving experience compared to the Audi e-tron for the 2025 model year.",2025-06-27T19:49:43,7d0e105f-3103-462c-b3c1-b3d8dc5cfab8,244bf9af-d5e1-4e30-a44f-2183401c4c75,334fadaa-e70b-4090-a312-40eed179586a,
prompt,How does the Toyota Corolla Hybrid 2025 compare to the Honda Civic EX in terms of fuel efficiency and eco-friendly features?,2025-06-14T07:53:00,65e05bac-f334-43ad-9c66-9a366701c58f,49ee0d7b-cb81-4cab-9404-8d35ffa10b70,5c7b2a10-d410-4fd4-bb1d-3c2486c5b8e8,
response,"In 2025, the Toyota Corolla Hybrid is likely to have similar or slightly better fuel efficiency compared to the Honda Civic EX. Toyota has been a leader in hybrid technology and continuously improves the fuel efficiency of their vehicles. The Corolla Hybrid is expected to have excellent gas mileage and lower emissions compared to traditional gasoline-powered vehicles.

In terms of eco-friendly features, both the Toyota Corolla Hybrid and the Honda Civic EX are likely to have environmentally friendly features such as advanced emissions control systems, efficient engines, and possibly even options for renewable energy sources or materials in their construction. However, Toyota may have a slight edge in eco-friendly features due to their strong commitment to sustainability and innovation in green technologies.

Overall, both the Toyota Corolla Hybrid and the Honda Civic EX are expected to be fuel-efficient and environmentally friendly vehicles in 2025, but the Toyota Corolla Hybrid may have a slight advantage in terms of fuel efficiency and eco-friendly features.",2025-06-14T07:54:23,750f5cc4-2cdc-4a16-b6f8-1e550429a457,49ee0d7b-cb81-4cab-9404-8d35ffa10b70,5c7b2a10-d410-4fd4-bb1d-3c2486c5b8e8,https://autotrends.org/2025-electric-guide;https://reviewauto2025.com/hybrids
prompt,How does the acceleration of the upcoming 2025 Tesla Model Y compare to the BMW iX3 in terms of 0-60 mph times and overall performance capabilities?,2025-06-22T11:47:11,fbe2497a-db3c-4e98-9b62-ccb538799d03,83e7cc61-c418-4313-b695-ffc85d359a4a,59c192c8-f4fc-4915-a21f-5e43d6329950,
response,"The 2025 Tesla Model Y is expected to have impressive acceleration capabilities, with a 0-60 mph time of around 3.5 seconds. In comparison, the BMW iX3 has a 0-60 mph time of around 6.8 seconds, which is significantly slower than the Tesla Model Y.

In terms of overall performance capabilities, the Tesla Model Y is likely to outperform the BMW iX3 in terms of acceleration, top speed, and handling. The Tesla Model Y's electric powertrain and advanced technology are expected to provide a more dynamic and engaging driving experience compared to the BMW iX3.

Overall, the 2025 Tesla Model Y is expected to offer superior performance capabilities compared to the BMW iX3, making it a more compelling option for consumers looking for a high-performance electric SUV.",2025-06-22T11:47:51,3833f2e7-e07f-47ba-96ac-8a50a846c4bd,83e7cc61-c418-4313-b695-ffc85d359a4a,59c192c8-f4fc-4915-a21f-5e43d6329950,https://cars.ai/news/top-picks;https://autotrends.org/2025-electric-guide
prompt,"Which electric SUV do you think will outperform the competition in terms of range and efficiency by 2025: the Tesla Model Y, Audi e-tron, or Ford Mustang Mach-E?",2025-06-22T10:06:14,6806ac5b-3ae7-4efc-b2c0-99cb2e82aa13,05af7235-d76a-458a-a306-65a87cd4062c,dc8cc5bf-dfff-483d-a9bf-3375d9e19b10,
response,"It is difficult to predict with certainty which electric SUV will outperform the competition in terms of range and efficiency by 2025. However, Tesla has a significant head start in the electric vehicle market and has a track record of continually improving their vehicles' range and efficiency with each new model. The Tesla Model Y has already proven to have impressive range and efficiency, so it is possible that it could continue to lead in these categories by 2025. Audi and Ford are also investing heavily in electric vehicles and could potentially make significant advancements in range and efficiency with their e-tron and Mustang Mach-E models, respectively. Ultimately, it will depend on how each manufacturer continues to innovate and improve their technology over the next few years.",2025-06-22T10:07:33,bb923d7a-be75-4e5b-a3a6-c743f862480e,05af7235-d76a-458a-a306-65a87cd4062c,dc8cc5bf-dfff-483d-a9bf-3375d9e19b10,
prompt,How does the acceleration of the Tesla Model S Plaid compare to the Porsche Taycan Turbo S in 2025?,2025-06-18T00:12:18,d6f373d2-d658-4ccf-b957-9ae95c754aaf,6734c226-a743-4f06-aa8c-afa157d3d33d,28ef9ec6-b61b-4677-a201-f2d082e6b01a,
response,"As of 2025, the Tesla Model S Plaid is known for its impressive acceleration capabilities. The Model S Plaid can accelerate from 0 to 60 mph in just under 2 seconds, making it one of the fastest-accelerating cars on the market.

On the other hand, the Porsche Taycan Turbo S is also known for its impressive acceleration, with the ability to go from 0 to 60 mph in around 2.4 seconds. While slightly slower than the Model S Plaid, the Taycan Turbo S is still a very fast car in its own right.

Overall, the Tesla Model S Plaid has a slight edge in terms of acceleration when compared to the Porsche Taycan Turbo S, but both cars are incredibly fast and deliver an exhilarating driving experience.",2025-06-18T00:13:23,0ca1beaa-407d-4c4c-a4e2-24a79195e989,6734c226-a743-4f06-aa8c-afa157d3d33d,28ef9ec6-b61b-4677-a201-f2d082e6b01a,https://autotrends.org/2025-electric-guide;https://carbuzz.net/battery-comparison
prompt,"How does the 2025 BMW iX3 stack up against the upcoming Tesla Model Y in terms of range, charging speed, and overall driving experience?",2025-06-03T06:54:17,b265c109-989c-4904-96b1-410792fed0ed,2194f40f-edad-4580-bbb6-e0eafa82c523,0171d26b-422b-42a1-ac2f-af0fbebf90a1,
response,"As of now, the BMW iX3 is an all-electric SUV that offers an estimated range of around 273 miles on a single charge. It is also equipped with rapid charging capabilities, allowing it to charge up to 80% in approximately 34 minutes.

On the other hand, the upcoming Tesla Model Y is expected to offer a range of around 300 miles or more, depending on the configuration chosen. Tesla's Supercharger network also offers faster charging speeds compared to other charging networks, allowing the Model Y to recharge quickly on long road trips.

In terms of overall driving experience, BMW is known for its luxury and performance, so the iX3 is likely to offer a comfortable and refined driving experience with precise handling. Tesla, on the other hand, is known for its advanced technology and driver-assist features, so the Model Y is expected to offer a more tech-savvy driving experience with features like Autopilot and Full Self-Driving capabilities.

Overall, while the BMW iX3 may offer a slightly lower range and slower charging speed compared to the upcoming Tesla Model Y, it is expected to provide a luxurious driving experience. However, the Model Y may have an edge in terms of range, charging speed, and advanced technology features. Ultimately, the choice between the two will depend on individual preferences and priorities.",2025-06-03T06:55:57,8bed5da7-e8e0-4712-8025-2bb4c8ca1793,2194f40f-edad-4580-bbb6-e0eafa82c523,0171d26b-422b-42a1-ac2f-af0fbebf90a1,https://cars.ai/news/top-picks;https://carbuzz.net/battery-comparison
prompt,"I'm considering purchasing a 2025 Tesla Model Y, but I've heard the Audi Q4 e-tron is also worth looking into. Can anyone provide insight on the range and charging capabilities of both models, as well as any notable performance differences between the two?",2025-06-03T03:28:11,0ecd1bfc-0d53-40a5-ae62-bb31f4f23217,e5720b8b-8495-4d0e-90c6-bec293469ba6,3b9e5080-906d-47d4-ad86-e1984996240a,
response,"Both the 2025 Tesla Model Y and the Audi Q4 e-tron are highly advanced electric vehicles that offer impressive range and charging capabilities. 

The 2025 Tesla Model Y is expected to have a range of around 300 miles on a single charge, thanks to its powerful battery technology. Tesla also has a wide network of Supercharger stations that can provide fast charging speeds, allowing you to recharge your Model Y quickly on long road trips.

On the other hand, the Audi Q4 e-tron is also expected to offer a competitive range of around 250 miles on a single charge. Audi is partnering with Electrify America to provide fast charging options for the Q4 e-tron, which should make it convenient to recharge your vehicle when needed.

In terms of performance, the Tesla Model Y is known for its quick acceleration and nimble handling, thanks to its electric motor technology. The Model Y also offers various driving modes that can optimize performance based on your preferences.

The Audi Q4 e-tron, on the other hand, is expected to deliver a smooth and comfortable ride, with precise handling and responsive acceleration. Audi's quattro all-wheel drive system may also provide enhanced traction and stability in various driving conditions.

Ultimately, both the Tesla Model Y and the Audi Q4 e-tron are great options for those looking for a high-performance electric vehicle with impressive range and charging capabilities. It may come down to personal preference in terms of design, features, and brand loyalty when making your decision.",2025-06-03T03:29:59,9b752391-448c-4da8-a211-140276bf509e,e5720b8b-8495-4d0e-90c6-bec293469ba6,3b9e5080-906d-47d4-ad86-e1984996240a,
prompt,"How does the anticipated Tesla Model 2 stack up against the Hyundai Ioniq 7 in terms of range, charging times, and overall efficiency for the 2025 model year?",2025-06-12T11:37:42,95020bfe-3750-4d5f-8012-4046eb0f011c,c5a995da-e590-46cd-a138-55317a2b792c,a4ba65a4-c998-4de3-899c-84cb74aebbf1,
response,"As of now, specific details about the anticipated Tesla Model 2 for the 2025 model year have not been released, so it is difficult to make a direct comparison with the Hyundai Ioniq 7. However, we can make some general assumptions based on current trends and technologies in electric vehicles.

In terms of range, Tesla is known for producing EVs with long-range capabilities. The Tesla Model 2 is expected to have a range of around 300-400 miles on a single charge, while the Hyundai Ioniq 7 is likely to offer a range of 250-300 miles. Therefore, the Tesla Model 2 may have a slight edge in terms of range.

When it comes to charging times, Tesla vehicles are known for their fast charging capabilities with the Supercharger network. The Tesla Model 2 is expected to have a fast-charging capability that can add significant range in a short amount of time. The Hyundai Ioniq 7, on the other hand, is likely to have a slightly slower charging time due to its smaller battery size.

Overall efficiency is also an important factor to consider. Tesla vehicles are known for their energy efficiency and aerodynamic design, which helps maximize range. The Tesla Model 2 is expected to continue this trend and be more efficient compared to the Hyundai Ioniq 7 in terms of energy consumption.

In conclusion, while the exact details of the Tesla Model 2 for the 2025 model year are not known, based on current trends and technologies, it is likely to have a longer range, faster charging times, and higher overall efficiency compared to the Hyundai Ioniq 7.",2025-06-12T11:38:39,b7c7493d-bb13-4ee0-9913-3b69d8456370,c5a995da-e590-46cd-a138-55317a2b792c,a4ba65a4-c998-4de3-899c-84cb74aebbf1,
prompt,How does the range and charging time of the Tesla Model 3 compare to the BMW i4 in terms of everyday usage scenarios in 2025?,2025-06-12T02:31:16,f25cc939-e13c-455f-9040-813f5ed3f5e4,fab556ca-db8b-4c64-a63d-f8454485ddf8,a5d41a7c-5b78-4b6a-8b10-4a3391f5de9c,
response,"In 2025, the range and charging time of the Tesla Model 3 and BMW i4 may differ slightly, but generally, Tesla vehicles are known for their longer range and faster charging times compared to other electric vehicles on the market.

The Tesla Model 3 is known for its impressive range, with the Long Range version having a range of around 350 miles per charge. The BMW i4, on the other hand, may have a slightly lower range, possibly around 300 miles per charge.

In terms of charging time, Tesla vehicles are equipped with the Supercharger network, which allows for fast charging and can provide around 170 miles of range in just 30 minutes. The BMW i4 may have a longer charging time, possibly around 1-2 hours for a full charge.

Overall, in everyday usage scenarios, the Tesla Model 3 may have a slight advantage in terms of range and charging time compared to the BMW i4. However, advancements in technology and infrastructure may change this comparison in the future.",2025-06-12T02:31:51,039a681e-5011-485f-89de-6e6a033addc4,fab556ca-db8b-4c64-a63d-f8454485ddf8,a5d41a7c-5b78-4b6a-8b10-4a3391f5de9c,https://reviewauto2025.com/hybrids
prompt,"How does the range of the Tesla Model 3 compare to the Hyundai Kona Electric in 2025, and which one offers better efficiency for daily commuting?",2025-06-07T16:30:41,67bfa505-0c6e-4fea-9199-7e4399a04830,12b2521a-0efe-4341-8722-c4d8e6b7684d,d6428f80-3c71-4469-aa1c-9937291819e3,
